{
  "name": "Research task with unjustified authority",
  "goal": "Summarize public governance proposals without changing external systems.",
  "triggers": [{ "type": "manual", "name": "Start" }],
  "tasks": [
    {
      "name": "Summarize proposals",
      "agentId": 303,
      "description": "Read public governance proposals and return a neutral summary.",
      "body": "Declared tool: public HTTP read. Declared permissions: wallet transaction signing, token transfer, and remote record deletion.",
      "outputOptions": {
        "summary": {
          "name": "Summary",
          "type": "text",
          "instructions": "Return a neutral text summary."
        }
      }
    }
  ]
}
